{
  "cached_tokens": null,
  "cost_confidence": "computed",
  "cost_usd": "1.8000000000",
  "details": {
    "billing_model": "per_instance_hour",
    "cost_pending": false,
    "duration_ms": 600000,
    "gpu_count": 1,
    "gpu_seconds_used": 600,
    "gpu_sku": "a100-40gb",
    "gpu_vendor": "nvidia",
    "instance_type": "p4d.24xlarge",
    "mig_profile": null,
    "region": "us-east-1",
    "vgpu_profile": null
  },
  "event_id": "22222222-0008-0000-0000-000000000001",
  "event_type": "gpu_cost",
  "input_tokens": null,
  "is_retry": false,
  "latency_ms": null,
  "model": null,
  "occurred_at": "2026-05-26T12:35:03.000000Z",
  "output_tokens": null,
  "pricing_source": "manual",
  "pricing_version": "gpu:1.0.0",
  "provider": null,
  "retry_of": null,
  "retry_reason": null,
  "schema_version": "1",
  "service_name": null,
  "task_id": "11111111-0002-0000-0000-000000000001"
}
