{
  "cached_tokens": null,
  "cost_confidence": "computed",
  "cost_usd": "0.0000000123",
  "details": {},
  "event_id": "22222222-000b-0000-0000-000000000001",
  "event_type": "llm_call",
  "input_tokens": 1,
  "is_retry": false,
  "latency_ms": 50,
  "model": "gpt-4o-mini",
  "occurred_at": "2026-05-26T12:35:06.000000+00:00",
  "output_tokens": 1,
  "pricing_source": "litellm",
  "pricing_version": "2026-05-01",
  "provider": "openai",
  "retry_of": null,
  "retry_reason": null,
  "schema_version": "1",
  "service_name": "openai",
  "task_id": "11111111-0003-0000-0000-000000000001"
}
