{
  "event_id": "22222222-000a-0000-0000-000000000001",
  "task_id": "11111111-0001-0000-0000-000000000001",
  "event_type": "retry_marker",
  "occurred_at": "2026-05-26T12:35:05.000000+00:00",
  "cost_usd": "0.0070",
  "cost_confidence": "exact",
  "pricing_source": "provider_response",
  "pricing_version": "2026-05-01",
  "service_name": "openai",
  "provider": "openai",
  "model": "gpt-4o",
  "input_tokens": 300,
  "output_tokens": 100,
  "cached_tokens": null,
  "latency_ms": 950,
  "is_retry": true,
  "retry_reason": "rate_limit",
  "retry_of": "22222222-0001-0000-0000-000000000001",
  "details": {},
  "schema_version": "1"
}
