{
  "event_id": "22222222-0006-0000-0000-000000000001",
  "task_id": "11111111-0001-0000-0000-000000000001",
  "event_type": "network",
  "occurred_at": "2026-05-26T12:35:01.000000Z",
  "cost_usd": "0.000900",
  "cost_confidence": "computed",
  "pricing_source": "manual",
  "pricing_version": "egress:1.0.0",
  "service_name": "api.openai.com",
  "provider": null,
  "model": null,
  "input_tokens": null,
  "output_tokens": null,
  "cached_tokens": null,
  "latency_ms": null,
  "is_retry": false,
  "retry_reason": null,
  "retry_of": null,
  "details": {
    "method": "POST",
    "status_code": 200,
    "protocol": "https",
    "request_bytes": 1024,
    "response_bytes": 10485760,
    "is_internal_traffic": false,
    "cost_pending": false
  },
  "schema_version": "1"
}
