{
  "cached_tokens": null,
  "cost_confidence": "computed",
  "cost_usd": "0.00000853335",
  "details": {
    "architecture": "x86_64",
    "billing_model": "lambda",
    "cost_pending": false,
    "duration_ms": 1000,
    "initialization_type": "on_demand",
    "invocation_count": 1,
    "memory_bytes_limit": 512000000,
    "memory_bytes_peak": 256000000,
    "region": "us-east-1",
    "vcpu_count": 0.5,
    "vcpu_seconds_used": 0.5
  },
  "event_id": "22222222-0003-0000-0000-000000000001",
  "event_type": "compute_cost",
  "input_tokens": null,
  "is_retry": false,
  "latency_ms": null,
  "model": null,
  "occurred_at": "2026-05-26T12:34:58.000000Z",
  "output_tokens": null,
  "pricing_source": "manual",
  "pricing_version": "compute:1.0.1",
  "provider": null,
  "retry_of": null,
  "retry_reason": null,
  "schema_version": "1",
  "service_name": null,
  "task_id": "11111111-0001-0000-0000-000000000001"
}
